{"title": "2x＋3＝11 を解こう", "subtitle": "（中1数学 一次方程式）", "problem": "2x＋3＝11 を満たす／xの値を求めなさい。", "intro_seconds": 4, "steps": [{"heading": "数を移項", "caption": "＋3を右辺へ移すと／符号が<r>−3<>に変わる", "formula": "2x ＝ 11 <r>− 3<>", "seconds": 9}, {"heading": "両辺を2で割る", "caption": "xの係数2で／両辺を割る", "formula": "x ＝ 8 ÷ 2 ＝ <g>4<>", "seconds": 9, "figure": {"type": "point", "min": 0, "max": 8, "from": 0, "to": 4, "label": "x"}}, {"heading": "グラフで確認", "caption": "y＝2x＋3 と y＝11 が／x＝4 で交わる", "formula": "2×4＋3 ＝ <g>11<> ✓", "seconds": 8, "figure": {"type": "graph", "xmin": 0, "xmax": 6, "ymin": 0, "ymax": 14, "lines": [{"a": 2, "b": 3, "color": "b", "label": "y＝2x＋3"}, {"a": 0, "b": 11, "color": "r", "label": "y＝11"}], "mark": [4, 11]}}]}