{"title": "遠ざかる音源で、観測者は何Hzで聞く？", "subtitle": "（ドップラー効果の符号）", "problem": "振動数720Hzの音源が／速さ20m/sで観測者から遠ざかる。／音速340m/sのとき観測者が聞く振動数は？", "intro_seconds": 4, "steps": [{"heading": "基本の式", "caption": "観測者は止まっているので／<o>v_o＝0<>", "formula": "f' ＝ f × (V − v_o) ÷ (V − v_s)", "seconds": 9, "figure": {"type": "wave", "label": "音速340m/s", "speed": 72}}, {"heading": "符号を決める", "caption": "遠ざかる＝正の向きと逆／<r>v_s＝−20<>", "formula": "v_s ＝ <r>−20<> m/s", "seconds": 9, "figure": {"type": "point", "min": -40, "max": 40, "from": 0, "to": -20, "label": "v_s"}}, {"heading": "計算する", "caption": "分母は340＋20＝360／<r>320にしない！<>", "formula": "720×340÷360 ＝ <g>680<> Hz", "seconds": 8, "figure": {"type": "wave", "label": "音速340m/s", "speed": 72}}]}